<?xml version="1.0" encoding="UTF-8" standalone="yes"?>
<xs:schema xmlns:xs="http://www.w3.org/2001/XMLSchema" version="1.0">
	<xs:include schemaLocation="../zones/zones.xsd"/>
	<xs:include schemaLocation="../world_maps.xsd"/>
	<xs:include schemaLocation="../import.xsd"/>
	<xs:element name="siege_locations">
		<xs:complexType>
			<xs:sequence>
				<xs:element ref="import" minOccurs="0" maxOccurs="unbounded"/>
				<xs:element name="siege_location" type="siegelocation" minOccurs="0" maxOccurs="unbounded"/>
			</xs:sequence>
		</xs:complexType>
	</xs:element>
	<xs:complexType name="siegelocation">
		<xs:sequence>
			<xs:element name="door_repair" type="DoorRepair" minOccurs="0" maxOccurs="unbounded"/>
			<xs:element name="artifact_activation" type="ArtifactActivation" minOccurs="0" maxOccurs="unbounded"/>
			<xs:element name="siege_reward" type="SiegeReward" minOccurs="0" maxOccurs="unbounded"/>
		</xs:sequence>
		<xs:attribute name="id" type="xs:int" use="required"/>
		<xs:attribute name="type" type="SiegeType" use="required"/>
		<xs:attribute name="world" type="xs:int" use="required"/>
		<xs:attribute name="name_id" type="xs:int"/>
		<xs:attribute name="fortress_dependency" type="DependencyList"/>
		<xs:attribute name="siege_duration" type="xs:int" use="optional" default="-1"/>
		<xs:attribute name="influence" type="xs:int" use="optional" default="0"/>
		<xs:attribute name="buff_id" type="xs:int" use="optional" default="0"/>
		<xs:attribute name="buff_idA" type="xs:int" use="optional" default="0"/>
		<xs:attribute name="buff_idE" type="xs:int" use="optional" default="0"/>
		<xs:attribute name="occupy_count" type="xs:int" use="optional" default="0"/>
	</xs:complexType>
	<xs:simpleType name="DependencyList">
		<xs:list itemType="xs:int"/>
	</xs:simpleType>
	<xs:simpleType name="SiegeType">
		<xs:restriction base="xs:string">
		    <xs:enumeration value="INDUN"/>
			<xs:enumeration value="FORTRESS"/>
			<xs:enumeration value="ARTIFACT"/>
			<xs:enumeration value="UNDERPASS"/>
			<xs:enumeration value="BOSSRAID_LIGHT"/>
			<xs:enumeration value="BOSSRAID_DARK"/>
		</xs:restriction>
	</xs:simpleType>
	<xs:complexType name="DoorRepair">
		<xs:attribute name="itemid" type="xs:int" use="optional" default="188030000"/>
		<xs:attribute name="repair_fee" type="xs:int"/>
		<xs:attribute name="repair_cooltime" type="xs:int" use="optional" default="-1"/>
	</xs:complexType>
	<xs:complexType name="ArtifactActivation">
		<xs:attribute name="itemid" type="xs:int" use="optional" default="188020000"/>
		<xs:attribute name="count" type="xs:int" use="optional" default="1"/>
		<xs:attribute name="skill" type="xs:int" use="optional" default="0"/>
		<xs:attribute name="repeat_count" type="xs:int" use="optional" default="1"/>
		<xs:attribute name="repeat_interval" type="xs:int" use="optional" default="1"/>
		<xs:attribute name="cd" type="xs:int" use="optional" default="-1"/>
	</xs:complexType>
	<xs:complexType name="SiegeReward">
		<xs:attribute name="item_id" type="xs:int" use="optional" default="0"/>
		<xs:attribute name="item_count" type="xs:int" use="optional" default="0"/>
		<xs:attribute name="item_id2" type="xs:int" use="optional" default="0"/>
        <xs:attribute name="item_count2" type="xs:int" use="optional" default="0"/>
		<xs:attribute name="item_id3" type="xs:int" use="optional" default="0"/>
        <xs:attribute name="item_count3" type="xs:int" use="optional" default="0"/>
		<xs:attribute name="item_id4" type="xs:int" use="optional" default="0"/>
        <xs:attribute name="item_count4" type="xs:int" use="optional" default="0"/>
		<xs:attribute name="item_id5" type="xs:int" use="optional" default="0"/>
        <xs:attribute name="item_count5" type="xs:int" use="optional" default="0"/>
        <xs:attribute name="ap_count" type="xs:int" use="optional" default="0"/>
        <xs:attribute name="exp_count" type="xs:int" use="optional" default="0"/>
        <xs:attribute name="kinah_count" type="xs:int" use="optional" default="0"/>
		<xs:attribute name="result" type="SiegeResult" use="optional"/>
	</xs:complexType>
	<xs:simpleType name="SiegeResult">
        <xs:restriction base="xs:string">
            <xs:enumeration value="DEFENCE"/>
            <xs:enumeration value="OCCUPY"/>
            <xs:enumeration value="PROTECT"/>
            <xs:enumeration value="DEFENDER"/>
			<xs:enumeration value="EMPTY"/>
			<xs:enumeration value="FAIL"/>
        </xs:restriction>
    </xs:simpleType>
</xs:schema>